{
  "urn": "urn:mcnet:v1:gcp:project_id=acme-prod-networking-123456:peering:projects/acme-prod-networking-123456/global/networks/prod-shared-vpc/peerings/prod-shared-vpc-to-partner-vpc",
  "native_id": "projects/acme-prod-networking-123456/global/networks/prod-shared-vpc/peerings/prod-shared-vpc-to-partner-vpc",
  "resource_type": "peering",
  "provider": "gcp",
  "scope": {
    "provider": "gcp",
    "project_id": "acme-prod-networking-123456",
    "collected_at": "2026-08-20T12:00:00Z"
  },
  "name": "prod-shared-vpc-to-partner-vpc",
  "tags": {},
  "observed_at": "2026-08-20T12:00:00Z",
  "source_api": "NetworksClient.get",
  "collection_completeness": "complete",
  "local_network_urn": "urn:mcnet:v1:gcp:project_id=acme-prod-networking-123456:network:https%3A//www.googleapis.com/compute/v1/projects/acme-prod-networking-123456/global/networks/prod-shared-vpc",
  "remote_network_urn": null,
  "remote_native_id": "https://www.googleapis.com/compute/v1/projects/acme-partner-services-654321/global/networks/partner-vpc",
  "state": "active",
  "allow_forwarded_traffic": null,
  "exchange_subnet_routes": true,
  "import_custom_routes": false,
  "export_custom_routes": false,
  "extensions": {
    "gcp": {
      "owning_network_self_link": "https://www.googleapis.com/compute/v1/projects/acme-prod-networking-123456/global/networks/prod-shared-vpc",
      "network": "https://www.googleapis.com/compute/v1/projects/acme-partner-services-654321/global/networks/partner-vpc",
      "state_details": "[ACTIVE]",
      "auto_create_routes": null,
      "stack_type": "IPV4_ONLY",
      "_note": "This is GCP's NetworkPeering, embedded on Network.peerings rather than returned by a standalone listing API (see gcp_network_mcp.models.peering.NetworkPeering) -- native_id is therefore a synthesized 'projects/.../networks/.../peerings/<name>' identifier, not a native self_link (GCP peerings have none of their own). remote_network_urn is null and remote_native_id is populated instead: partner-vpc lives in project acme-partner-services-654321, a scope this collection's credentials cannot read into (no cross-project IAM binding visible), so the peer network cannot be resolved to a RESOURCE node -- see the paired UNRESOLVED node in topology-graph.gcp-vpc-topology.json and its CollectionWarning. allow_forwarded_traffic is null: GCP's NetworkPeering has no matching field at all (that concept is Azure-specific); exchange_subnet_routes/import_custom_routes/export_custom_routes are GCP's own genuine, directly-observed fields, unlike for an AWS-sourced Peering where this contract's docstring says those must stay null."
    }
  }
}
